### ISSUE TITLE
Customize SMTP Port and/or full SMTP URI

### ISSUE THREAD

**Issue by TrezOne** [scanopy/scanopy#586]
**Is your feature request related to a problem? Please describe.**
This is somewhat related to #372. DNS resolves just fine, but if you're using another SMTP service/relay (self-hosted or otherwise) the UI kicks back `Failed to send email: Connection error: Connection refused (os error 111)`. Running a `tcpdump` shows that Scanopy tries to connect to the specified SMTP server over port 465 (.254 is the SMTP server).

```
› sudo tcpdump -i any -n 'dst 192.168.1.254 and tcp[tcpflags] & tcp-syn != 0'
tcpdump: data link type LINUX_SLL2
tcpdump: verbose output suppressed, use -v[v]... for full protocol decode
listening on any, link-type LINUX_SLL2 (Linux cooked v2), snapshot length 262144 bytes
16:18:49.348801 vethf60b0c2 P   IP 172.18.0.10.60188 > 192.168.1.254.8082: Flags [S], seq 2740257550, win 64240, options [mss 1460,sackOK,TS val 4260175221 ecr 0,nop,wscale 7], length 0
16:18:49.348817 br-bbba1147f632 In  IP 172.18.0.10.60188 > 192.168.1.254.8082: Flags [S], seq 2740257550, win 64240, options [mss 1460,sackOK,TS val 4260175221 ecr 0,nop,wscale 7], length 0
16:18:49.348931 enp85s0 Out IP 192.168.1.248.60188 > 192.168.1.254.8082: Flags [S], seq 2740257550, win 64240, options [mss 1460,sackOK,TS val 4260175221 ecr 0,nop,wscale 7], length 0
16:18:54.348251 vethf60b0c2 P   IP 172.18.0.10.60198 > 192.168.1.254.8082: Flags [S], seq 1454945097, win 64240, options [mss 1460,sackOK,TS val 4260180221 ecr 0,nop,wscale 7], length 0
16:18:54.348257 br-bbba1147f632 In  IP 172.18.0.10.60198 > 192.168.1.254.8082: Flags [S], seq 1454945097, win 64240, options [mss 1460,sackOK,TS val 4260180221 ecr 0,nop,wscale 7], length 0
16:18:54.348293 enp85s0 Out IP 192.168.1.248.60198 > 192.168.1.254.8082: Flags [S], seq 1454945097, win 64240, options [mss 1460,sackOK,TS val 4260180221 ecr 0,nop,wscale 7], length 0
16:18:59.348915 vethf60b0c2 P   IP 172.18.0.10.43484 > 192.168.1.254.8082: Flags [S], seq 1536176451, win 64240, options [mss 1460,sackOK,TS val 4260185221 ecr 0,nop,wscale 7], length 0
16:18:59.348923 br-bbba1147f632 In  IP 172.18.0.10.43484 > 192.168.1.254.8082: Flags [S], seq 1536176451, win 64240, options [mss 1460,sackOK,TS val 4260185221 ecr 0,nop,wscale 7], length 0
16:18:59.348967 enp85s0 Out IP 192.168.1.248.43484 > 192.168.1.254.8082: Flags [S], seq 1536176451, win 64240, options [mss 1460,sackOK,TS val 4260185221 ecr 0,nop,wscale 7], length 0
**16:19:01.599451 vethf474c60 P   IP 172.18.0.17.39826 > 192.168.1.254.465: Flags [S], seq 1601044021, win 64240, options [mss 1460,sackOK,TS val 1668094062 ecr 0,nop,wscale 7], length 0**
**16:19:01.599455 br-bbba1147f632 In  IP 172.18.0.17.39826 > 192.168.1.254.465: Flags [S], seq 1601044021, win 64240, options [mss 1460,sackOK,TS val 1668094062 ecr 0,nop,wscale 7], length 0**
**16:19:01.599483 enp85s0 Out IP 192.168.1.248.39826 > 192.168.1.254.465: Flags [S], seq 1601044021, win 64240, options [mss 1460,sackOK,TS val 1668094062 ecr 0,nop,wscale 7], length 0**
16:19:04.348493 vethf60b0c2 P   IP 172.18.0.10.43490 > 192.168.1.254.8082: Flags [S], seq 2384092515, win 64240, options [mss 1460,sackOK,TS val 4260190221 ecr 0,nop,wscale 7], length 0
16:19:04.348503 br-bbba1147f632 In  IP 172.18.0.10.43490 > 192.168.1.254.8082: Flags [S], seq 2384092515, win 64240, options [mss 1460,sackOK,TS val 4260190221 ecr 0,nop,wscale 7], length 0
16:19:04.348567 enp85s0 Out IP 192.168.1.248.43490 > 192.168.1.254.8082: Flags [S], seq 2384092515, win 64240, options [mss 1460,sackOK,TS val 4260190221 ecr 0,nop,wscale 7], length 0
16:19:09.348241 vethf60b0c2 P   IP 172.18.0.10.43358 > 192.168.1.254.8082: Flags [S], seq 2821633814, win 64240, options [mss 1460,sackOK,TS val 4260195221 ecr 0,nop,wscale 7], length 0
16:19:09.348245 br-bbba1147f632 In  IP 172.18.0.10.43358 > 192.168.1.254.8082: Flags [S], seq 2821633814, win 64240, options [mss 1460,sackOK,TS val 4260195221 ecr 0,nop,wscale 7], length 0
16:19:09.348273 enp85s0 Out IP 192.168.1.248.43358 > 192.168.1.254.8082: Flags [S], seq 2821633814, win 64240, options [mss 1460,sackOK,TS val 4260195221 ecr 0,nop,wscale 7], length 0
```

**Describe the solution you'd like**
Add an additional env to be set, e.g., `SCANOPY_SMTP_PORT` and/or `SCANOPY_SMTP_URI`.

**Describe alternatives you've considered**
N/A

**Additional context**
N/A

**Comment by mayanayza** [comment]
This is implemented in v0.17.0. Please give it a shot and lmk!
